<?xml version="1.0" encoding="UTF-8" standalone="no"?>
<DISCIPLINE name="Archer-Bowman" lang="en" bookref="PC p.23" xmlns="http://earthdawn.com/discipline" xmlns:xsi="http://www.w3.org/2001/XMLSchema-instance" xmlns:edt="http://earthdawn.com/datatypes" xsi:schemaLocation="http://earthdawn.com/discipline ../../earthdawndiscipline.xsd">
	<DURABILITY death="6" unconsciousness="5"/>
	<CIRCLE><!-- 1 -->
		<OPTIONALTALENT name="Avoid Blow"/>
		<OPTIONALTALENT name="Climbing"/>
		<OPTIONALTALENT name="Melee Weapons"/>
		<OPTIONALTALENT name="Silent Walk"/>
		<OPTIONALTALENT name="Tracking"/>
		<DISCIPLINETALENT name="Karma Ritual"/>
		<DISCIPLINETALENT name="Missile Weapons"/>
		<DISCIPLINETALENT name="Mystic Aim"/>
		<DISCIPLINETALENT name="Throwing Weapons"/>
		<DISCIPLINETALENT name="True Shot"/>
		<TALENTABILITY/>
	</CIRCLE>
	<CIRCLE><!-- 2 -->
		<OPTIONALTALENT name="Detect Weapon"/>
		<OPTIONALTALENT name="Durability"/>
		<OPTIONALTALENT name="First Impression"/>
		<OPTIONALTALENT name="Flame Arrow"/>
		<OPTIONALTALENT name="Great Leap"/>
		<OPTIONALTALENT name="Anticipate Blow"/>
		<OPTIONALTALENT name="Speak Language"/>
		<OPTIONALTALENT name="Sprint"/>
		<DISCIPLINETALENT name="Direction Arrow"/>
		<TALENTABILITY/>
		<DEFENSE kind="physical"/>
	</CIRCLE>
	<CIRCLE><!-- 3 -->
		<DISCIPLINETALENT name="Long Shot"/>
		<TALENTABILITY/>
	</CIRCLE>
	<CIRCLE><!-- 4 -->
		<DISCIPLINETALENT name="Thread Weaving" limitation="Arrow Weaving"/>
		<TALENTABILITY/>
		<KARMA spend="Dexterity-only Test"/>
	</CIRCLE>
	<CIRCLE><!-- 5 -->
		<OPTIONALTALENT name="Call Missile"/>
		<OPTIONALTALENT name="Conceal Object"/>
		<OPTIONALTALENT name="Creature Analysis"/>
		<OPTIONALTALENT name="Empathic Sense"/>
		<OPTIONALTALENT name="Evidence Analysis"/>
		<OPTIONALTALENT name="Heartening Laugh"/>
		<OPTIONALTALENT name="Lip Reading"/>
		<OPTIONALTALENT name="Stopping Aim"/>
		<DISCIPLINETALENT name="Steel Thought"/>
		<TALENTABILITY/>
		<ABILITY>Arrow's Eye View</ABILITY>
	</CIRCLE>
	<CIRCLE><!-- 6 -->
		<DISCIPLINETALENT name="Bank Shot"/>
		<TALENTABILITY/>
		<KARMA spend="Perception-only Test"/>
	</CIRCLE>
	<CIRCLE><!-- 7 -->
		<DISCIPLINETALENT name="Impressive Shot"/>
		<TALENTABILITY/>
		<KARMA spend="ranged combat Damage Test"/>
	</CIRCLE>
	<CIRCLE><!-- 8 -->
		<DISCIPLINETALENT name="Second Shot"/>
		<TALENTABILITY/>
		<DEFENSE kind="physical"/>
	</CIRCLE>
	<CIRCLE><!-- 9 -->
		<OPTIONALTALENT name="Blade Juggle"/>
		<OPTIONALTALENT name="Critical Hit"/>
		<OPTIONALTALENT name="Lifesight"/>
		<OPTIONALTALENT name="Rushing Attack"/>
		<OPTIONALTALENT name="Quick Shot"/>
		<OPTIONALTALENT name="Tiger Spring"/>
		<OPTIONALTALENT name="Trace Missile"/>
		<OPTIONALTALENT name="Warp Missile"/>
		<DISCIPLINETALENT name="Eagle Eye"/>
		<TALENTABILITY/>
		<KARMA spend="Recovery Test"/>
		<ABILITY>Create Arrow</ABILITY>
	</CIRCLE>
	<CIRCLE><!-- 10 -->
		<DISCIPLINETALENT name="Warning Shot"/>
		<TALENTABILITY/>
		<DEFENSE kind="physical"/>
		<INITIATIVE/>
	</CIRCLE>
	<CIRCLE><!-- 11 -->
		<DISCIPLINETALENT name="Dominate Arrow"/>
		<TALENTABILITY/>
		<DEFENSE kind="social"/>
		<DEFENSE kind="spell"/>
		<RECOVERYTEST/>
	</CIRCLE>
	<CIRCLE><!-- 12 -->
		<DISCIPLINETALENT name="Blind Fire"/>
		<TALENTABILITY/>
		<DEFENSE kind="physical"/>
		<INITIATIVE/>
	</CIRCLE>
	<CIRCLE><!-- 13 -->
		<OPTIONALTALENT name="Chameleon"/>
		<OPTIONALTALENT name="Defense"/>
		<OPTIONALTALENT name="Ethereal Weapon"/>
		<OPTIONALTALENT name="Lion Spirit"/>
		<OPTIONALTALENT name="Second Chance"/>
		<OPTIONALTALENT name="True Sight"/>
		<DISCIPLINETALENT name="Multi-Shot"/>
		<TALENTABILITY/>
		<DEFENSE kind="spell"/>
		<KARMASTEP/>
		<ABILITY>Hail of Arrows</ABILITY>
	</CIRCLE>
	<CIRCLE><!-- 14 -->
		<DISCIPLINETALENT name="Screaming Arrow"/>
		<TALENTABILITY/>
		<DEFENSE kind="physical"/>
		<INITIATIVE/>
	</CIRCLE>
	<CIRCLE><!-- 15 -->
		<DISCIPLINETALENT name="Wind Bow"/>
		<TALENTABILITY/>
		<DEFENSE kind="spell"/>
		<DEFENSE kind="social"/>
		<RECOVERYTEST/>
	</CIRCLE>
	<KARMARITUAL>Please insert a short description of your Karma Ritual. It have to last for 30 minutes</KARMARITUAL>
	<HALFMAGIC>caring for ranged weapons; recognize types ranged weapons, ammunition, their creators; Skill: Craft Weapon make ranged weapons, ammunition; (PG p.43)</HALFMAGIC>
</DISCIPLINE>
