<?xml version="1.0" encoding="UTF-8" standalone="yes"?>
<DISCIPLINE  name="Troubadour" lang="en" xmlns="http://earthdawn.com/discipline" xmlns:xsi="http://www.w3.org/2001/XMLSchema-instance" xmlns:edt="http://earthdawn.com/datatypes" xsi:schemaLocation="http://earthdawn.com/discipline ../earthdawndiscipline.xsd">
	<DURABILITY circle="1" death="6" unconsciousness="5"/>
	<CIRCLE><!-- 1 -->
		<OPTIONALTALENT name="Emotion Song"/>
		<OPTIONALTALENT name="Haggle"/>
		<OPTIONALTALENT name="Melee Weapons"/>
		<OPTIONALTALENT name="Read/Write Language"/>
		<OPTIONALTALENT name="Speak Language"/>
		<DISCIPLINETALENT name="First Impression"/>
		<DISCIPLINETALENT name="Impress"/>
		<DISCIPLINETALENT name="Item History"/>
		<DISCIPLINETALENT name="Karma Ritual"/>
		<DISCIPLINETALENT name="Mimic Voice"/>
		<TALENTABILITY/>
	</CIRCLE>
	<CIRCLE><!-- 2 -->
		<OPTIONALTALENT name="Avoid Blow"/>
		<OPTIONALTALENT name="Durability"/>
		<OPTIONALTALENT name="Etiquette"/>
		<OPTIONALTALENT name="Heartening Laugh"/>
		<OPTIONALTALENT name="Last Impression"/>
		<OPTIONALTALENT name="Taunt"/>
		<OPTIONALTALENT name="Throwing Weapons"/>
		<OPTIONALTALENT name="Winning Smile"/>
		<DISCIPLINETALENT name="Disguise Self"/>
		<TALENTABILITY/>
		<DEFENSE kind="social"/>
	</CIRCLE>
	<CIRCLE><!-- 3 -->
		<DISCIPLINETALENT name="Empathic Sense"/>
		<TALENTABILITY/>
	</CIRCLE>
	<CIRCLE><!-- 4 -->
		<DISCIPLINETALENT name="Thread Weaving" limitation="Story Weaving"/>
		<TALENTABILITY/>
		<KARMA spend="Charisma-only Test"/>
	</CIRCLE>
	<CIRCLE><!-- 5 -->
		<OPTIONALTALENT name="Blade Juggle"/>
		<OPTIONALTALENT name="Book Memory"/>
		<OPTIONALTALENT name="Diplomacy"/>
		<OPTIONALTALENT name="Engaging Banter"/>
		<OPTIONALTALENT name="Graceful Exit"/>
		<OPTIONALTALENT name="Performance"/>
		<OPTIONALTALENT name="Research"/>
		<OPTIONALTALENT name="Slough Blame"/>
		<DISCIPLINETALENT name="Inspire Others"/>
		<TALENTABILITY/>
		<ABILITY>One Last Word</ABILITY>
	</CIRCLE>
	<CIRCLE><!-- 6 -->
		<DISCIPLINETALENT name="Resist Taunt"/>
		<TALENTABILITY/>
		<KARMA spend="Perception-only Test"/>
	</CIRCLE>
	<CIRCLE><!-- 7 -->
		<DISCIPLINETALENT name="Leadership"/>
		<TALENTABILITY/>
		<KARMA spend="another's person social Action Test"/>
	</CIRCLE>
	<CIRCLE><!-- 8 -->
		<DISCIPLINETALENT name="Lion Heart"/>
		<TALENTABILITY/>
		<DEFENSE kind="social"/>
	</CIRCLE>
</DISCIPLINE>
