<?xml version="1.0" encoding="UTF-8" standalone="no"?>
<DISCIPLINE name="Liberator" lang="en" bookref="NG p.159" xmlns="http://earthdawn.com/discipline" xmlns:xsi="http://www.w3.org/2001/XMLSchema-instance" xmlns:edt="http://earthdawn.com/datatypes" xsi:schemaLocation="http://earthdawn.com/discipline ../../earthdawndiscipline.xsd">
	<DURABILITY death="8" unconsciousness="6"/>
	<CIRCLE><!-- 1 -->
		<OPTIONALTALENT name="Acrobatic Strike"/>
		<OPTIONALTALENT name="Avoid Blow"/>
		<OPTIONALTALENT name="Disguise Self"/>
		<OPTIONALTALENT name="Silent Walk"/>
		<OPTIONALTALENT name="Unarmed Combat"/>
		<DISCIPLINETALENT name="Freedom Search"/>
		<DISCIPLINETALENT name="Karma Ritual"/>
		<DISCIPLINETALENT name="Lock Picking"/>
		<DISCIPLINETALENT name="Melee Weapons"/>
		<DISCIPLINETALENT name="Shackle Shrug"/>
		<TALENTABILITY/>
	</CIRCLE>
	<CIRCLE><!-- 2 -->
		<OPTIONALTALENT name="Conceal Object"/>
		<OPTIONALTALENT name="Durability"/>
		<OPTIONALTALENT name="Fireblood"/>
		<OPTIONALTALENT name="Heart of Freedom"/>
		<OPTIONALTALENT name="Heartening Laugh"/>
		<OPTIONALTALENT name="Surprise Strike"/>
		<OPTIONALTALENT name="Throwing Weapons"/>
		<OPTIONALTALENT name="Tiger Spring"/>
		<DISCIPLINETALENT name="Free Mind"/>
		<TALENTABILITY/>
		<DEFENSE kind="physical"/>
	</CIRCLE>
	<CIRCLE><!-- 3 -->
		<DISCIPLINETALENT name="Shout of Jusice"/>
		<TALENTABILITY/>
	</CIRCLE>
	<CIRCLE><!-- 4 -->
		<DISCIPLINETALENT name="Thread Weaving" limitation="Freedom Weaving"/>
		<TALENTABILITY/>
		<KARMA spend="Charisma-only Test"/>
	</CIRCLE>
	<CIRCLE><!-- 5 -->
		<OPTIONALTALENT name="Dead Fall"/>
		<OPTIONALTALENT name="Disarm"/>
		<OPTIONALTALENT name="Heal Slave"/>
		<OPTIONALTALENT name="Leadership"/>
		<OPTIONALTALENT name="Lion Heart"/>
		<OPTIONALTALENT name="Resist Taunt"/>
		<OPTIONALTALENT name="Second Attack"/>
		<OPTIONALTALENT name="Temper Self"/>
		<DISCIPLINETALENT name="False Shackles"/>
		<TALENTABILITY/>
		<ABILITY>Shield of the Weak</ABILITY>
	</CIRCLE>
	<CIRCLE><!-- 6 -->
		<DISCIPLINETALENT name="Hoard Blows"/>
		<TALENTABILITY/>
		<KARMA spend="Willpower-only Test"/>
	</CIRCLE>
	<CIRCLE><!-- 7 -->
		<DISCIPLINETALENT name="Mind Blade"/>
		<TALENTABILITY/>
		<KARMA spend="Action Test made against a slaver or made to resist a slaver´s abilities"/>
	</CIRCLE>
	<CIRCLE><!-- 8 -->
		<DISCIPLINETALENT name="Power Mask"/>
		<TALENTABILITY/>
		<DEFENSE kind="physical"/>
	</CIRCLE>
	<CIRCLE><!-- 9 -->
		<OPTIONALTALENT name="Champion Challenge"/>
		<OPTIONALTALENT name="Critical Hit"/>
		<OPTIONALTALENT name="Frenzy"/>
		<OPTIONALTALENT name="Life Check"/>
		<OPTIONALTALENT name="Pin"/>
		<OPTIONALTALENT name="Resist Pain"/>
		<OPTIONALTALENT name="Steel Thought"/>
		<OPTIONALTALENT name="Temper Other"/>
		<DISCIPLINETALENT name="Prison Call"/>
		<TALENTABILITY/>
		<KARMA spend="Recovery Test"/>
		<ABILITY>Freedom Quest</ABILITY>
	</CIRCLE>
	<CIRCLE><!-- 10 -->
		<DISCIPLINETALENT name="Mind Armor"/>
		<TALENTABILITY/>
		<DEFENSE kind="physical"/>
		<INITIATIVE/>
	</CIRCLE>
	<CIRCLE><!-- 11 -->
		<DISCIPLINETALENT name="Escape Divination"/>
		<TALENTABILITY/>
		<DEFENSE kind="spell"/>
		<DEFENSE kind="social"/>
	</CIRCLE>
	<CIRCLE><!-- 12 -->
		<DISCIPLINETALENT name="Impossible Hide"/>
		<TALENTABILITY/>
		<DEFENSE kind="physical"/>
		<RECOVERYTEST/>
	</CIRCLE>
	<CIRCLE><!-- 13 -->
		<OPTIONALTALENT name="Blood Guilt Weapon"/>
		<OPTIONALTALENT name="Chameleon"/>
		<OPTIONALTALENT name="Echo Location"/>
		<OPTIONALTALENT name="Ethereal Weapon"/>
		<OPTIONALTALENT name="Multi-Strike"/>
		<OPTIONALTALENT name="Rushing Attack"/>
		<DISCIPLINETALENT name="Second Chance"/>
		<TALENTABILITY/>
		<DEFENSE kind="social"/>
		<KARMASTEP/>
		<ABILITY>Heart of Rebellion</ABILITY>
	</CIRCLE>
	<CIRCLE><!-- 14 -->
		<DISCIPLINETALENT name="Vitality"/>
		<TALENTABILITY/>
		<DEFENSE kind="physical"/>
		<INITIATIVE/>
	</CIRCLE>
	<CIRCLE><!-- 15 -->
		<DISCIPLINETALENT name="Vital Strike"/>
		<TALENTABILITY/>
		<DEFENSE kind="spell"/>
		<DEFENSE kind="social"/>
	</CIRCLE>
	<KARMARITUAL>Please insert a short description of your Karma Ritual. It have to last for 30 minutes</KARMARITUAL>
	<HALFMAGIC>gathering intelligence to inspire rebellion; knowledge: slaver tactics/ strategy, events of the Great Uprising and Hrak Gron’s life;(NG p.159)</HALFMAGIC>
</DISCIPLINE>
